### ISSUE TITLE
Some network packets are not captured

### ISSUE THREAD

**Issue by anjmao** [aquasecurity/tracee#3277]
## Description

Hi team. Looks that some igress/egress tcp packets are not capture for Kubernetes load balancer to pod traffic data path.

You can check it by installing onlineboutique demo app from microsoft.

```sh
helm upgrade --install onlineboutique oci://us-docker.pkg.dev/online-boutique-ci/charts/onlineboutique -n eshop --create-namespace
```

It contains frontend pod which is exposed to the internet via LoadBalancer. I'm using simple GKE cluster with DataPlane V2 (cilium).

I traced __cgroup_bpf_run_filter_skb kprobe with pwru running in separate tracee container and I can see my public IP xx.xx.xx.xx

```
0xffff89223a35b700     0    [ksoftirqd/0] __cgroup_bpf_run_filter_skb xx.xx.xx.xx:53658->10.72.0.13:8080(tcp) SYN|ECE|CWR
0xffff89223a35bd00     0    [ksoftirqd/0] __cgroup_bpf_run_filter_skb 10.72.0.13:8080->xx.xx.xx.xx:53658(tcp) SYN|ACK|ECE
0xffff89223af04400      1   [flb-pipeline] __cgroup_bpf_run_filter_skb xx.xx.xx.xx:53656->10.72.0.13:8080(tcp) ACK
0xffff89224649f400      1         [server] __cgroup_bpf_run_filter_skb xx.xx.xx.xx:53656->10.72.0.13:8080(tcp) PSH|ACK
0xffff8922509c9ee0      0         [server] __cgroup_bpf_run_filter_skb 10.72.0.13:8080->xx.xx.xx.xx:53656(tcp) PSH|ACK
0xffff89220397cc00      0    [ksoftirqd/0] __cgroup_bpf_run_filter_skb xx.xx.xx.xx:53658->10.72.0.13:8080(tcp) ACK
                                          0         [server] __cgroup_bpf_run_filter_skb 10.72.0.13:8080->xx.xx.xx.xx:53656(tcp) PSH|ACK
0xffff89229598c8e0      0         [server] __cgroup_bpf_run_filter_skb 10.72.0.13:8080->xx.xx.xx.xx:53656(tcp) PSH|ACK
```

## Output of `tracee version`:

```
Tracee version: "v0.15.1"
```

## Output of `uname -a`:

```
5.15.0-1028-gke #33-Ubuntu SMP Mon Feb 20 01:54:13 UTC 2023 x86_64 x86_64 x86_64 GNU/Linux
```

**Comment by anjmao** [comment]
Tracee is installed with helm. I updated default policy to trace only event=net_packet_tcp
```sh
helm install tracee aqua/tracee \     
    --namespace tracee-system --create-namespace \
    --set hostPID=true
```

Searching via loki I can't find any logs matching my ip `{namespace="tracee-system"} |= 'xx.xx.xx.xx'`. Also checked directly by using grep on container logs.

On the other hand `{namespace="tracee-system"} |= "10.72.0.13"` finds packets to other internal demo app services as expected.

Topology: I have 2 e2-standard-2 nodes with 1.25.8-gke.1000 cluster and Ubuntu OS.

**Comment by rafaeldtinoco** [comment]
Alright. Tracee does not trace network packets in the network card level, it does in the application level. 

The packets you are likely seeing are the packets already mangled by your CNI already (with external IPs converted into internals ones, either by the proxy service or load balancing), no ?

Just making sure I understand it right.

**Comment by anjmao** [comment]
Hi @rafaeldtinoco 

Yes, you are correct. Here is some traffic capture:

* xx.xx.xx.xx - my public IP calling 34.30.75.102.80
* 34.30.75.102.80 is load balancer's public IP
* ens4 main nic on vm
* gke6b61c6ada6e container's nic which is managed by cilium

```
10:27:09.804823 ens4  In  IP xx.xx.xx.xx.54906 > 34.30.75.102.80: Flags [SEW], seq 413257011, win 65535, options [mss 1460,nop,wscale 6,nop,nop,TS val 4123177096 ecr 0,sackOK,eol], length 0
10:27:09.804938 gke6b61c6ada6e Out IP xx.xx.xx.xx.54906 > 10.72.1.16.8080: Flags [SEW], seq 413257011, win 65535, options [mss 1460,nop,wscale 6,nop,nop,TS val 4123177096 ecr 0,sackOK,eol], length 0
10:27:09.805016 gke6b61c6ada6e In  IP 10.72.1.16.8080 > xx.xx.xx.xx.54906: Flags [S.E], seq 3062156739, ack 413257012, win 43648, options [mss 1420,sackOK,TS val 820676078 ecr 4123177096,nop,wscale 7], length 0
10:27:09.805034 ens4  Out IP 34.30.75.102.80 > xx.xx.xx.xx.54906: Flags [S.E], seq 3062156739, ack 413257012, win 43648, options [mss 1420,sackOK,TS val 820676078 ecr 4123177096,nop,wscale 7], length 0
10:27:09.966789 ens4  In  IP xx.xx.xx.xx.54906 > 34.30.75.102.80: Flags [.], ack 1, win 2068, options [nop,nop,TS val 4123177282 ecr 820676078], length 0
10:27:09.966879 gke6b61c6ada6e Out IP xx.xx.xx.xx.54906 > 10.72.1.16.8080: Flags [.], ack 1, win 2068, options [nop,nop,TS val 4123177282 ecr 820676078], length 0
10:27:09.967559 ens4  In  IP xx.xx.xx.xx.54906 > 34.30.75.102.80: Flags [P.], seq 1:572, ack 1, win 2068, options [nop,nop,TS val 4123177282 ecr 820676078], length 571: HTTP: GET /product/OLJCESPC7Z HTTP/1.1
10:27:09.967617 gke6b61c6ada6e Out IP xx.xx.xx.xx.54906 > 10.72.1.16.8080: Flags [P.], seq 1:572, ack 1, win 2068, options [nop,nop,TS val 4123177282 ecr 820676078], length 571: HTTP: GET /product/OLJCESPC7Z HTTP/1.1
10:27:09.967689 gke6b61c6ada6e In  IP 10.72.1.16.8080 > xx.xx.xx.xx.54906: Flags [.], ack 572, win 337, options [nop,nop,TS val 820676241 ecr 4123177282], length 0
10:27:09.967722 ens4  Out IP 34.30.75.102.80 > xx.xx.xx.xx.54906: Flags [.], ack 572, win 337, options [nop,nop,TS val 820676241 ecr 4123177282], length 0
```

I modified cgroup_skb_generic a bit just to capture TCP IPv4 headers and output into test perf buf. Wasn't able to make it work with original code. Is it correct to expect that I should hit this place https://github.com/aquasecurity/tracee/blob/main/pkg/ebpf/c/tracee.bpf.c#L5561 if network context is not available for this data path?

```c
statfunc u32 cgroup_skb_generic_simple(struct __sk_buff *ctx)
{
    struct sk_buff *skb = (void *) ctx;
    void *skb_head = BPF_CORE_READ(skb, head);
    u16 l3_off = BPF_CORE_READ(skb, network_header);
    u16 l4_off = BPF_CORE_READ(skb, transport_header);

    struct iphdr *l3_hdr = (struct iphdr *) (skb_head + l3_off);
    u8 ip_vsn = BPF_CORE_READ_BITFIELD_PROBED(l3_hdr, version);
    if (ip_vsn != 4) {
        return 1;
    }

    struct iphdr *ip4 = (struct iphdr *) l3_hdr;
    u16 l4_proto = BPF_CORE_READ(ip4, protocol);
    if (l4_proto != IPPROTO_TCP) {
        return 1;
    }

    struct tcphdr *tcp = (struct tcphdr *) (skb_head + l4_off);

    tuple_t ev = {0};
    ev.saddr = BPF_CORE_READ(ip4, saddr);
    if (is_v4_loopback(ev.saddr)) {
        return 1;
    }

    ev.daddr = BPF_CORE_READ(ip4, daddr);
    ev.sport = bpf_ntohs(BPF_CORE_READ(tcp, source));
    ev.dport = bpf_ntohs(BPF_CORE_READ(tcp, dest));
    ev.family = ctx->family;
    bpf_perf_event_output(ctx, &tc_events, BPF_F_CURRENT_CPU, &ev, sizeof(tuple_t));
    return 1;
}
```

**Comment by rafaeldtinoco** [comment]
> I modified cgroup_skb_generic a bit just to capture TCP IPv4 headers and output into test perf buf. Wasn't able to make it work with original code. Is it correct to expect that I should hit this place https://github.com/aquasecurity/tracee/blob/main/pkg/ebpf/c/tracee.bpf.c#L5561 if network context is not available for this data path?

Ok, before answering you I need to understand what Tracee was able to capture (until now you just showed me the output of your code test).

1. What is the output of tracee ? Is there any ?
2. Have you tried running tracee manually in a compute node ? Are there any differences ?

**Comment by rafaeldtinoco** [comment]
I'll try to reproduce at my end today so its clear to me. Let me know the output of tracee (in comparison to your tool) when you run tracee in the compute node with:

docker run --name tracee --rm -it --pid=host --cgroupns=host --privileged -v /etc/os-release:/etc/os-release-host:ro -e LIBBPFGO_OSRELEASE_FILE=/etc/os-release-host -v /boot/config-$(uname -r):/boot/config-$(uname -r):ro aquasec/tracee:$(uname -m) --filter event=net_packet_ipv4

**Comment by anjmao** [comment]
Here is some output. Hope it helps.

```
14:21:39:904504  0      kubelet          2462    2529    0                net_packet_ipv4           src: 127.0.0.1, dst: 127.0.0.1, proto_ipv4: {4 5 0 2428 8291 2 0 64 TCP 4887 127.0.0.1 127.0.0.1}
14:21:39:914070  0      containerd       2343    14866   0                net_packet_ipv4           src: 127.0.0.1, dst: 127.0.0.1, proto_ipv4: {4 5 0 56 8292 2 0 64 TCP 7258 127.0.0.1 127.0.0.1}
14:21:39:914131  0      kubelet          2462    2529    0                net_packet_ipv4           src: 127.0.0.1, dst: 127.0.0.1, proto_ipv4: {4 5 0 56 8292 2 0 64 TCP 7258 127.0.0.1 127.0.0.1}
14:21:39:914271  0      kubelet          2462    2529    0                net_packet_ipv4           src: 127.0.0.1, dst: 127.0.0.1, proto_ipv4: {4 5 0 52 49261 2 0 64 TCP 31828 127.0.0.1 127.0.0.1}
14:21:39:914313  0      containerd       2343    14866   0                net_packet_ipv4           src: 127.0.0.1, dst: 127.0.0.1, proto_ipv4: {4 5 0 52 49261 2 0 64 TCP 31828 127.0.0.1 127.0.0.1}
14:21:39:915570  0      containerd       2343    14866   0                net_packet_ipv4           src: 127.0.0.1, dst: 127.0.0.1, proto_ipv4: {4 5 0 56 8293 2 0 64 TCP 7257 127.0.0.1 127.0.0.1}
14:21:39:915629  0      kubelet          2462    2529    0                net_packet_ipv4           src: 127.0.0.1, dst: 127.0.0.1, proto_ipv4: {4 5 0 56 8293 2 0 64 TCP 7257 127.0.0.1 127.0.0.1}
14:21:39:915760  0      containerd       2343    14866   0                net_packet_ipv4           src: 127.0.0.1, dst: 127.0.0.1, proto_ipv4: {4 5 0 1634 8294 2 0 64 TCP 5678 127.0.0.1 127.0.0.1}
14:21:39:915786  0      kubelet          2462    2529    0                net_packet_ipv4           src: 127.0.0.1, dst: 127.0.0.1, proto_ipv4: {4 5 0 1634 8294 2 0 64 TCP 5678 127.0.0.1 127.0.0.1}
14:21:39:916598  0      kubelet          2462    2529    0                net_packet_ipv4           src: 127.0.0.1, dst: 127.0.0.1, proto_ipv4: {4 5 0 52 49262 2 0 64 TCP 31827 127.0.0.1 127.0.0.1}
14:21:39:916647  0      containerd       2343    14866   0                net_packet_ipv4           src: 127.0.0.1, dst: 127.0.0.1, proto_ipv4: {4 5 0 52 49262 2 0 64 TCP 31827 127.0.0.1 127.0.0.1}
14:21:39:920789  0      containerd       2343    56290   0                net_packet_ipv4           src: 127.0.0.1, dst: 127.0.0.1, proto_ipv4: {4 5 0 56 8295 2 0 64 TCP 7255 127.0.0.1 127.0.0.1}
14:21:39:920833  0      kubelet          2462    2529    0                net_packet_ipv4           src: 127.0.0.1, dst: 127.0.0.1, proto_ipv4: {4 5 0 56 8295 2 0 64 TCP 7255 127.0.0.1 127.0.0.1}
14:21:39:921786  0      containerd       2343    56290   0                net_packet_ipv4           src: 127.0.0.1, dst: 127.0.0.1, proto_ipv4: {4 5 0 56 8296 2 0 64 TCP 7254 127.0.0.1 127.0.0.1}
14:21:39:921833  0      kubelet          2462    2529    0                net_packet_ipv4           src: 127.0.0.1, dst: 127.0.0.1, proto_ipv4: {4 5 0 56 8296 2 0 64 TCP 7254 127.0.0.1 127.0.0.1}
14:21:39:921956  0      kubelet          2462    2529    0                net_packet_ipv4           src: 127.0.0.1, dst: 127.0.0.1, proto_ipv4: {4 5 0 52 49263 2 0 64 TCP 31826 127.0.0.1 127.0.0.1}
14:21:39:921989  0      containerd       2343    56290   0                net_packet_ipv4           src: 127.0.0.1, dst: 127.0.0.1, proto_ipv4: {4 5 0 52 49263 2 0 64 TCP 31826 127.0.0.1 127.0.0.1}
14:21:39:922690  0      containerd       2343    56290   0                net_packet_ipv4           src: 127.0.0.1, dst: 127.0.0.1, proto_ipv4: {4 5 0 1242 8297 2 0 64 TCP 6067 127.0.0.1 127.0.0.1}
14:21:39:922740  0      kubelet          2462    2529    0                net_packet_ipv4           src: 127.0.0.1, dst: 127.0.0.1, proto_ipv4: {4 5 0 1242 8297 2 0 64 TCP 6067 127.0.0.1 127.0.0.1}
14:21:39:923777  1001   sidecar          1       13      0                net_packet_ipv4           src: 127.0.0.1, dst: 127.0.0.1, proto_ipv4: {4 5 0 55 4900 2 0 64 UDP 10640 127.0.0.1 127.0.0.1}
14:21:39:924243  0      dnsmasq          11      11      0                net_packet_ipv4           src: 127.0.0.1, dst: 127.0.0.1, proto_ipv4: {4 5 0 73 40355 2 0 64 UDP 40702 127.0.0.1 127.0.0.1}
14:21:39:924283  1001   sidecar          1       13      0                net_packet_ipv4           src: 127.0.0.1, dst: 127.0.0.1, proto_ipv4: {4 5 0 73 40355 2 0 64 UDP 40702 127.0.0.1 127.0.0.1}
14:21:39:924825  1001   sidecar          1       13      0                net_packet_ipv4           src: 127.0.0.1, dst: 127.0.0.1, proto_ipv4: {4 5 0 57 22966 2 0 64 UDP 58107 127.0.0.1 127.0.0.1}
14:21:39:924863  0      dnsmasq          11      11      0                net_packet_ipv4           src: 127.0.0.1, dst: 127.0.0.1, proto_ipv4: {4 5 0 57 22966 2 0 64 UDP 58107 127.0.0.1 127.0.0.1}
14:21:39:925005  0      dnsmasq          11      11      0                net_packet_ipv4           src: 127.0.0.1, dst: 127.0.0.1, proto_ipv4: {4 5 0 75 40356 2 0 64 UDP 40699 127.0.0.1 127.0.0.1}
14:21:39:925032  1001   sidecar          1       13      0                net_packet_ipv4           src: 127.0.0.1, dst: 127.0.0.1, proto_ipv4: {4 5 0 75 40356 2 0 64 UDP 40699 127.0.0.1 127.0.0.1}
14:21:39:925836  1001   sidecar          1       13      0                net_packet_ipv4           src: 127.0.0.1, dst: 127.0.0.1, proto_ipv4: {4 5 0 60 65069 2 0 64 UDP 16001 127.0.0.1 127.0.0.1}
14:21:39:925859  0      dnsmasq          11      11      0                net_packet_ipv4           src: 127.0.0.1, dst: 127.0.0.1, proto_ipv4: {4 5 0 60 65069 2 0 64 UDP 16001 127.0.0.1 127.0.0.1}
14:21:39:926376  0      dnsmasq          11      11      0                net_packet_ipv4           src: 127.0.0.1, dst: 127.0.0.1, proto_ipv4: {4 5 0 74 40357 2 0 64 UDP 40699 127.0.0.1 127.0.0.1}
14:21:39:926400  1001   sidecar          1       13      0                net_packet_ipv4           src: 127.0.0.1, dst: 127.0.0.1, proto_ipv4: {4 5 0 74 40357 2 0 64 UDP 40699 127.0.0.1 127.0.0.1}
```

**Comment by rafaeldtinoco** [comment]
What did you run without any filter ? Tracee within k8s as a deamonset or manually using docker ? Where is the output from ? From your run ? 

I see you grep for external IPs and you find them. Isn't this expected ? What did you expect ? Why do you say there are missing packets ?

**Comment by anjmao** [comment]
> What did you run without any filter ? Tracee within k8s as a deamonset or manually using docker ? Where is the output from ? From your run ?

Run from k8s node the same command as suggested.
```
docker run --name tracee --rm -it --pid=host --cgroupns=host --privileged -v /etc/os-release:/etc/os-release-host:ro -e LIBBPFGO_OSRELEASE_FILE=/etc/os-release-host -v /boot/config-$(uname -r):/boot/config-$(uname -r):ro aquasec/tracee:$(uname -m) --filter event=net_packet_ipv4
```


> I see you grep for external IPs and you find them. Isn't this expected ? What did you expect ? Why do you say there are missing packets ?
Sorry, could you clarify. In my example output all ips are private in 10.0.0.0/8 subnet. I used grep for `10.72.1.16` pod's internal ip.
